{"$schema":"https://json-schema.org/draft/2020-12/schema","title":"Project Supernova Runtime Update Receipt v2.4","type":"object","additionalProperties":false,"required":["task_network_plan_id","runtime_update_id","runtime_before","runtime_after","artifact_hashes","validator_results","lineage_identity","accounting_identity","before_after_diagnostics","fresh_prospective_evidence_refs","preservation_regression_checks","independent_verification","status"],"properties":{"task_network_plan_id":{"const":"0aa341106cfc5b104ab9ca9c2ae116d490a258685e28d26d5435860c53bb12aa"},"runtime_update_id":{"type":"string"},"runtime_before":{"type":"string"},"runtime_after":{"type":"string"},"artifact_hashes":{"type":"object"},"validator_results":{"type":"array"},"lineage_identity":{"type":"string"},"accounting_identity":{"type":"string"},"before_after_diagnostics":{"type":"object"},"fresh_prospective_evidence_refs":{"type":"array"},"preservation_regression_checks":{"type":"array"},"independent_verification":{"type":"object"},"status":{"enum":["VALIDATED","REJECTED","INCOMPLETE"]}}}
