{
  "task_network_plan_id": "0aa341106cfc5b104ab9ca9c2ae116d490a258685e28d26d5435860c53bb12aa",
  "runtime_update_id": "GEN8-FOUNDRY-3.1.1-REPLAY-BINDING",
  "runtime_before": "9d0a88cc9001295b5e4c0f4163e83c0fd64ce04521e34230ad3539af14f3dfaf",
  "runtime_after": "9d0a88cc9001295b5e4c0f4163e83c0fd64ce04521e34230ad3539af14f3dfaf",
  "artifact_hashes": {
    "foundry_sha256": "57c57394bda484c4ec4613c312080682a37670ebb6cec06d061979e39f1ec64f",
    "mastermind_sha256": "026a4d845ac021baa9f90c7c48c1f77f19f57065d257e45824025f5f467a9d0d",
    "substrate_epoch_path": "config/substrate_epoch_v25.json",
    "substrate_epoch_git_identity": "057eab7844f124136ad0ce85be7babeb1baff9c3",
    "foundry_manifest_sha256": "6d1220f99cc342be427fee0401db0259c90cceedf02ff8b684fc0dcfab41c743",
    "foundry_content_manifest_sha256": "d422d6d5f76ae895649f688d1fab4f22c211887c327e1eb11e9646fdcd5a1bc8",
    "foundry_qualification_result_sha256": "32c92aee61100fab918b60867be1fc873c274521a64ffbe1ffe10ed4529f1396",
    "foundry_release_receipt_sha256": "13b323fa2c7dc24aa42358a26d918674d1b7558762109d9b729736a468f79b9e"
  },
  "validator_results": [
    {
      "validator": "MATH_FOUNDRY_3.1.1_FRESH_EXTRACTION_QUALIFICATION",
      "status": "PASS",
      "passed": 28,
      "total": 28,
      "authority": "SOFTWARE_QUALIFICATION_ONLY"
    },
    {
      "validator": "SUPERNOVA_SUBSTRATE_IDENTITY_BINDING",
      "status": "PASS",
      "foundry_hash_bound": true,
      "mastermind_hash_preserved": true,
      "runtime_state_preserved": true
    }
  ],
  "lineage_identity": "GEN7_CANDIDATE7_TO_GEN8_MF311_REPLAY_SUBSTRATE_ONLY",
  "accounting_identity": "ZERO_FRESH_ZERO_SCIENTIFIC_ZERO_CALIBRATION_CREDIT",
  "before_after_diagnostics": {
    "update_class": "REPLAY_CALIBRATION_SUBSTRATE_BINDING",
    "runtime_bound_before": {
      "base_runtime_state_id": "9d0a88cc9001295b5e4c0f4163e83c0fd64ce04521e34230ad3539af14f3dfaf",
      "runtime_state_id": "9d0a88cc9001295b5e4c0f4163e83c0fd64ce04521e34230ad3539af14f3dfaf",
      "foundry_sha256": "5bfe4bf2cc7e8c4cb9751b831803e28eb45cebe22c0085310c8f00459caf994e",
      "mastermind_sha256": "026a4d845ac021baa9f90c7c48c1f77f19f57065d257e45824025f5f467a9d0d",
      "actual_runtime_plan_id": "f0031a07c1cfb23a8183e393b3ef26c92cd7cfa7b64e00af4466b52d90dc02d8",
      "canonical_bus_repo": "Kitahl/Project-supernova-",
      "private_vault_repo": "Kitahl/thoma"
    },
    "runtime_bound_after": {
      "base_runtime_state_id": "9d0a88cc9001295b5e4c0f4163e83c0fd64ce04521e34230ad3539af14f3dfaf",
      "runtime_state_id": "9d0a88cc9001295b5e4c0f4163e83c0fd64ce04521e34230ad3539af14f3dfaf",
      "foundry_sha256": "57c57394bda484c4ec4613c312080682a37670ebb6cec06d061979e39f1ec64f",
      "mastermind_sha256": "026a4d845ac021baa9f90c7c48c1f77f19f57065d257e45824025f5f467a9d0d",
      "actual_runtime_plan_id": "f0031a07c1cfb23a8183e393b3ef26c92cd7cfa7b64e00af4466b52d90dc02d8",
      "canonical_bus_repo": "Kitahl/Project-supernova-",
      "private_vault_repo": "Kitahl/thoma"
    }
  },
  "fresh_prospective_evidence_refs": [],
  "preservation_regression_checks": [
    {"check": "runtime_state_identity_unchanged", "status": "PASS"},
    {"check": "mastermind_identity_unchanged", "status": "PASS"},
    {"check": "fresh_evidence_zero", "status": "PASS"},
    {"check": "scientific_status_unchanged", "status": "PASS"}
  ],
  "independent_verification": {
    "status": "PASS",
    "qualification_class": "SOFTWARE_REPLAY_CALIBRATION_ONLY",
    "scientific_status_changed": false,
    "fresh_evidence_consumed": false,
    "evidence_basis": "Math Foundry 3.1.1 release receipt and 28/28 fresh-extraction qualification identities recorded in issue #96; Supernova binds hashes only for replay calibration."
  },
  "status": "VALIDATED"
}
